{
  "schemaVersion": 2,
  "region": "nl",
  "scope": {
    "jurisdictions": [
      "NL"
    ],
    "languages": [
      "nl"
    ]
  },
  "rules": [
    {
      "id": "regex:nl:bsn",
      "entityType": "SSN",
      "pattern": "\\b\\d{9}\\b",
      "flags": "g",
      "confidence": 0.85,
      "domains": [
        "identity",
        "hr"
      ],
      "classification": {
        "category": "identity",
        "subtype": "social_security_number",
        "applicability": "baseline",
        "verticals": [
          "employment"
        ],
        "protectionLevel": "essential",
        "defaultAction": "hide",
        "provenance": "doccloak",
        "status": "active"
      },
      "description": "Dutch citizen service number (BSN, 9 digits with elfproef validation)",
      "examples": [
        "123456782"
      ],
      "falsePositiveNotes": "9 bare digits match many formats; elfproef validation essential",
      "validate": "bsn"
    },
    {
      "id": "regex:nl:phone_mobile",
      "entityType": "PHONE",
      "pattern": "\\b(?:\\+?31[\\s-]?|0)6[\\s-]?\\d{4}[\\s-]?\\d{4}\\b",
      "flags": "g",
      "confidence": 0.85,
      "domains": [
        "contact"
      ],
      "classification": {
        "category": "contact",
        "subtype": "mobile_phone",
        "applicability": "baseline",
        "verticals": [],
        "protectionLevel": "essential",
        "defaultAction": "hide",
        "provenance": "doccloak",
        "status": "active"
      },
      "description": "Dutch mobile phone number (06 prefix)",
      "examples": [
        "+31 6 1234 5678",
        "06 12345678"
      ]
    },
    {
      "id": "regex:nl:phone_landline",
      "entityType": "PHONE",
      "pattern": "\\b(?:\\+?31[\\s-]?|0)[1-5]\\d[\\s-]?\\d{3}[\\s-]?\\d{4}\\b",
      "flags": "g",
      "confidence": 0.75,
      "domains": [
        "contact"
      ],
      "classification": {
        "category": "contact",
        "subtype": "landline_phone",
        "applicability": "baseline",
        "verticals": [],
        "protectionLevel": "essential",
        "defaultAction": "hide",
        "provenance": "doccloak",
        "status": "active"
      },
      "description": "Dutch landline phone number (area code prefix)",
      "examples": [
        "+31 20 123 4567",
        "020 1234567"
      ]
    },
    {
      "id": "regex:nl:postal",
      "entityType": "ADDRESS",
      "pattern": "\\b\\d{4}\\s?[A-Z]{2}\\b",
      "flags": "g",
      "confidence": 0.8,
      "domains": [
        "contact"
      ],
      "classification": {
        "category": "location",
        "subtype": "postal_code",
        "applicability": "baseline",
        "verticals": [],
        "protectionLevel": "recommended",
        "defaultAction": "hide",
        "provenance": "doccloak",
        "status": "active"
      },
      "description": "Dutch postal code (4 digits + 2 letters)",
      "examples": [
        "1012 AB",
        "3511XA"
      ]
    },
    {
      "id": "regex:nl:street",
      "entityType": "ADDRESS",
      "pattern": "[\\p{L}][\\p{L} \\t\\u00A0'-]*(?:straat|weg|laan|plein|gracht|kade|singel|dijk|steeg|dreef|hof|markt)\\s+\\d{1,5}[\\p{L}]?",
      "flags": "giu",
      "confidence": 0.85,
      "domains": [
        "contact"
      ],
      "classification": {
        "category": "location",
        "subtype": "street_address",
        "applicability": "baseline",
        "verticals": [],
        "protectionLevel": "recommended",
        "defaultAction": "hide",
        "provenance": "doccloakModified",
        "status": "active"
      },
      "description": "Dutch street address (name + straat/weg/laan/gracht + number) (Docudis change: no line break inside the name)",
      "examples": [
        "Keizersgracht 123",
        "Dorpsstraat 45a",
        "Marktplein 7"
      ]
    },
    {
      "id": "regex:nl:company",
      "entityType": "COMPANY",
      "pattern": "[\\p{L}][\\p{L} \\t\\u00A0&.']+(?:\\s+)?(?:B\\.?V\\.?|N\\.?V\\.?|V\\.?O\\.?F\\.?|C\\.?V\\.?)\\b",
      "flags": "gu",
      "confidence": 0.9,
      "domains": [
        "legal",
        "financial"
      ],
      "classification": {
        "category": "organization",
        "subtype": "company",
        "applicability": "baseline",
        "verticals": [
          "legal",
          "finance"
        ],
        "protectionLevel": "recommended",
        "defaultAction": "hide",
        "provenance": "doccloakModified",
        "status": "active"
      },
      "description": "Dutch company name with legal form (B.V., N.V., V.O.F., C.V.) (Docudis change: no line break inside the name)",
      "examples": [
        "Philips N.V.",
        "Shell Nederland B.V."
      ]
    }
  ]
}
